{
  "$schema": "http://json-schema.org/draft-07/schema#",
  "type": [
    "object",
    "null"
  ],
  "properties": {
    "timestamp": {
      "type": "string"
    },
    "orderId": {
      "type": "string"
    },
    "orderUpdateId": {
      "type": "integer"
    },
    "action": {
      "type": "object",
      "properties": {
        "id": {
          "type": "string"
        },
        "command": {
          "type": "string"
        },
        "metadata": {
          "type": "object",
          "properties": {
            "type": {
              "type": "string"
            },
            "workpieceId": {
              "type": "string"
            },
            "workpiece": {
              "type": "object",
              "properties": {
                "workpieceId": {
                  "type": "string"
                },
                "type": {
                  "type": "string"
                },
                "history": {
                  "type": "array",
                  "items": {
                    "type": "object",
                    "properties": {
                      "ts": {
                        "type": "integer"
                      },
                      "code": {
                        "type": "integer"
                      }
                    },
                    "required": [
                      "code",
                      "ts"
                    ]
                  }
                },
                "state": {
                  "type": "string"
                }
              },
              "required": [
                "history",
                "state",
                "type",
                "workpieceId"
              ]
            }
          }
        }
      },
      "required": [
        "command",
        "id",
        "metadata"
      ]
    },
    "serialNumber": {
      "type": "string"
    }
  },
  "required": [
    "action",
    "orderId",
    "orderUpdateId",
    "timestamp"
  ],
  "title": "Module_V1_Ff_Nodered_Serial_Order Schema",
  "description": "Granular schema for module_v1_ff_NodeRed_serial_order topics from 47 examples",
  "category": "module",
  "additionalProperties": true
}