{
  "timestamp": "2025-10-01T09:40:23.104Z",
  "serialNumber": "SVR4H76530",
  "orderId": "d41940cc-356f-4c98-8352-d57c039b9b8e",
  "orderUpdateId": 7,
  "action": {
    "id": "71d1a4a5-b745-4bb1-a912-5ec45d1da862",
    "command": "PICK",
    "metadata": {
      "type": "WHITE",
      "workpieceId": "047b8bca341291"
    }
  }
}