{
  "timestamp": "2025-10-01T11:19:38.229Z",
  "serialNumber": "SVR3QA2098",
  "orderId": "aa74c367-dfc6-4c3b-b669-af293ea717f1",
  "orderUpdateId": 5,
  "action": {
    "id": "1d6b6de5-68e5-4387-914c-9d6ffe4f29ca",
    "command": "DROP",
    "metadata": {
      "type": "RED",
      "workpieceId": "040a8dca341291"
    }
  }
}