{
  "timestamp": "2025-10-01T11:35:10.201Z",
  "serialNumber": "SVR3QA0022",
  "orderId": "a2d2309a-6395-4f83-90de-b9edd85c5f02",
  "orderUpdateId": 3,
  "action": {
    "id": "87df2fe0-b887-414b-b17b-2a2691021a3a",
    "command": "PICK",
    "metadata": {
      "type": "RED",
      "workpieceId": "040a8dca341291"
    }
  }
}