{
  "serialNumber": "SVR4H76530",
  "orderId": "0f77cfd1-c4ec-4e5f-8262-d9de2add939a",
  "orderUpdateId": 10,
  "timestamp": "2025-10-01T10:14:18.407Z",
  "action": {
    "command": "CHECK_QUALITY",
    "id": "205375e9-ecb6-43b6-a65d-e8a4d9f8df74",
    "metadata": {
      "type": "RED",
      "workpieceId": "04fa8cca341290"
    }
  }
}