{
  "serialNumber": "SVR4H76530",
  "orderId": "65b5edec-e634-4485-86c9-af4b8ad4d3f4",
  "orderUpdateId": 10,
  "timestamp": "2025-10-01T10:16:30.280Z",
  "action": {
    "command": "CHECK_QUALITY",
    "id": "a8d53f9a-aaf2-4a6c-a2f1-f81ee61c8491",
    "metadata": {
      "type": "RED",
      "workpieceId": "04808dca341291"
    }
  }
}