{
  "timestamp": "2025-10-01T10:06:22.431Z",
  "serialNumber": "SVR4H73275",
  "orderId": "8b54cc26-e37b-4428-887e-35da7fb574fd",
  "orderUpdateId": 1,
  "action": {
    "id": "789b7014-836d-44d2-b17b-2d661222c96b",
    "command": "DROP",
    "metadata": {
      "workpiece": {
        "workpieceId": "047389ca341291",
        "type": "BLUE",
        "history": [],
        "state": "PROCESSED"
      }
    }
  }
}