{
  "timestamp": "2025-10-01T10:13:25.637Z",
  "serialNumber": "SVR3QA2098",
  "orderId": "0f77cfd1-c4ec-4e5f-8262-d9de2add939a",
  "orderUpdateId": 3,
  "action": {
    "id": "58aefacb-3bf6-4fa1-828d-11bd5a2efbfe",
    "command": "PICK",
    "metadata": {
      "type": "RED",
      "workpieceId": "04fa8cca341290"
    }
  }
}