{
  "timestamp": "2025-10-01T11:33:13.516Z",
  "serialNumber": "SVR3QA0022",
  "orderId": "e35d0f89-8cc5-4672-84bf-d408b31ea121",
  "orderUpdateId": 3,
  "action": {
    "id": "5fedde2e-2524-4fa5-ad30-6d3183bbb126",
    "command": "PICK",
    "metadata": {
      "type": "RED",
      "workpieceId": "04f08dca341290"
    }
  }
}